{"$schema":"https://json-schema.org/draft/2020-12/schema","$id":"https://landoclusters.com/floati/schemas/v1/wake-attempt-record.schema.json","type":"object","additionalProperties":false,"required":["schema_version","id","tenant_id","timestamp","kind","node_id","acting_session_id","message_worker_session_id","idempotency_key","item_ids","decision_receipt_id","outcome","reason_code"],"properties":{"schema_version":{"type":"integer","const":1},"id":{"type":"string","pattern":"^wake-attempt-[0-9a-f]{12}7[0-9a-f]{3}[89ab][0-9a-f]{15}$"},"tenant_id":{"type":"string","pattern":"^[a-z0-9](?:[a-z0-9_-]{0,62}[a-z0-9])?$"},"timestamp":{"type":"string","format":"date-time","pattern":"^\\d{4}-\\d{2}-\\d{2}T\\d{2}:\\d{2}:\\d{2}(?:\\.\\d{3})?Z$"},"kind":{"const":"wake_attempt_receipt"},"node_id":{"type":"string","pattern":"^[a-z0-9](?:[a-z0-9_-]{0,62}[a-z0-9])?$"},"acting_session_id":{"type":"string","minLength":1,"maxLength":512,"x-floati-terminal-unsafe":true},"message_worker_session_id":{"type":["string","null"],"minLength":1,"maxLength":512,"x-floati-terminal-unsafe":true},"idempotency_key":{"type":"string","minLength":1,"maxLength":128,"x-floati-terminal-unsafe":true},"item_ids":{"type":"array","minItems":1,"maxItems":1000,"uniqueItems":true,"items":{"type":"string","pattern":"^msg-[0-9a-f]{12}7[0-9a-f]{3}[89ab][0-9a-f]{15}$"}},"decision_receipt_id":{"type":["string","null"],"pattern":"^wake-hold-[0-9a-f]{12}7[0-9a-f]{3}[89ab][0-9a-f]{15}$"},"outcome":{"enum":["woke","queued","refused"]},"reason_code":{"type":["string","null"],"enum":[null,"wake_envelope_not_owned","wake_decision_missing","wake_decision_mismatch","wake_prompt_failed","wake_hook_untrusted","wake_hook_modified","wake_hook_disabled","wake_daemon_adapter_timeout","wake_daemon_adapter_unavailable","wake_daemon_adapter_nonzero","wake_daemon_adapter_unknown","wake_daemon_cursor_output_empty","wake_daemon_cursor_output_invalid","wake_daemon_cursor_result_invalid","wake_daemon_grok_output_empty","wake_daemon_grok_output_invalid","wake_daemon_grok_result_invalid","wake_daemon_zcode_output_empty","wake_daemon_zcode_output_invalid","wake_daemon_zcode_result_invalid"]}},"allOf":[{"if":{"properties":{"outcome":{"enum":["woke","queued"]}},"required":["outcome"]},"then":{"properties":{"decision_receipt_id":{"type":"string"},"reason_code":{"type":"null"}}},"else":{"properties":{"reason_code":{"type":"string"}}}}]}
