{"acting_session_id": "fixture-session", "decision_receipt_id": "wake-hold-00000000000070008000000000000003", "id": "wake-attempt-00000000000070008000000000000001", "idempotency_key": "fixture-attempt", "item_ids": ["msg-00000000000070008000000000000002"], "kind": "wake_attempt_receipt", "message_worker_session_id": null, "node_id": "worker", "outcome": "woke", "reason_code": null, "schema_version": 1, "tenant_id": "alpha", "timestamp": "2026-09-05T00:00:00Z"}
